{
  "$schema": "http://json-schema.org/draft-04/schema#",
  "$id": "https://raw.githubusercontent.com/OrcaBus/case-manager/refs/heads/main/case-manager/app/schemas/events/case_external_entity_relationship_created.json",
  "description": "EventBridge event schema for updates to relationships between cases and external entities.",
  "title": "CaseRelationshipUpdateEvent",
  "type": "object",
  "required": ["detail-type", "detail", "source"],
  "properties": {
    "id": {
      "type": "string"
    },
    "region": {
      "type": "string"
    },
    "resources": {
      "type": "array",
      "items": {
        "type": "string"
      }
    },
    "source": {
      "enum": ["orcabus.casemanager"]
    },
    "time": {
      "type": "string",
      "format": "date-time"
    },
    "version": {
      "type": "string"
    },
    "account": {
      "type": "string"
    },
    "detail-type": {
      "type": "string"
    },
    "detail": {
      "$ref": "#/definitions/CaseRelationshipUpdate"
    }
  },
  "definitions": {
    "CaseRelationshipUpdate": {
      "type": "object",
      "required": ["action", "addedVia", "case", "externalEntity"],
      "properties": {
        "action": {
          "type": "string",
          "enum": ["CREATE", "DELETE"]
        },
        "addedVia": {
          "type": "string"
        },
        "case": {
          "type": "object"
        },
        "externalEntity": {
          "type": "object"
        }
      }
    }
  }
}
